{
  "$schema": "https://json-schema.org/draft/2020-12/schema",
  "title": "Status page config",
  "description": "What the status page checks and how it looks. See the README for every setting.",
  "type": "object",
  "additionalProperties": false,
  "required": ["title"],
  "properties": {
    "$schema": {
      "type": "string"
    },
    "title": {
      "type": "string",
      "minLength": 1,
      "description": "The page's heading and browser tab title, such as \"Acme status\"."
    },
    "description": {
      "type": "string",
      "description": "A sentence under the heading, also used as the page's meta description."
    },
    "groups": {
      "type": "array",
      "items": { "type": "string" },
      "description": "The order groups appear in. Groups not listed come after, in alphabetical order."
    },
    "intervalMinutes": {
      "type": "integer",
      "minimum": 1,
      "maximum": 1440,
      "default": 5,
      "description": "How often the checks run. Keep it in step with the schedule in .github/workflows/status.yml."
    },
    "targets": {
      "type": "array",
      "description": "The addresses to check.",
      "items": {
        "type": "object",
        "additionalProperties": false,
        "required": ["id", "url"],
        "properties": {
          "id": {
            "type": "string",
            "pattern": "^[a-z0-9][a-z0-9-]*$",
            "description": "A short, permanent name for the target. Changing it starts its history over."
          },
          "label": {
            "type": "string",
            "description": "The name shown on the page. Defaults to the id."
          },
          "group": {
            "type": "string",
            "default": "Services",
            "description": "The section the target appears in."
          },
          "url": {
            "type": "string",
            "pattern": "^https?://",
            "description": "The address to request. It's never shown on the page, but it's in this file, so in a public repository it's public."
          },
          "method": {
            "enum": ["GET", "HEAD"],
            "default": "GET"
          },
          "expectedStatus": {
            "description": "The status codes that count as up. Without it, any 2xx or 3xx code does.",
            "oneOf": [
              { "type": "integer", "minimum": 100, "maximum": 599 },
              {
                "type": "array",
                "minItems": 1,
                "items": { "type": "integer", "minimum": 100, "maximum": 599 }
              }
            ]
          },
          "contains": {
            "type": "string",
            "description": "Text the response has to contain to count as up. Needs the GET method."
          },
          "timeoutMilliseconds": {
            "type": "integer",
            "minimum": 1000,
            "maximum": 60000,
            "default": 10000,
            "description": "How long to wait before the target counts as down."
          },
          "slowAfterMilliseconds": {
            "type": "integer",
            "minimum": 0,
            "maximum": 60000,
            "default": 3000,
            "description": "An answer slower than this counts as degraded."
          }
        }
      }
    },
    "sources": {
      "type": "array",
      "description": "Status documents for the page to show instead of the built-in monitor's. Each gets a tab. To keep the monitor's too, add a source with the url \"status.json\".",
      "items": {
        "type": "object",
        "additionalProperties": false,
        "required": ["label", "url"],
        "properties": {
          "label": {
            "type": "string",
            "description": "The tab's name, such as \"Canada\"."
          },
          "url": {
            "type": "string",
            "description": "Where to read the document. It has to allow cross-origin requests."
          },
          "format": {
            "enum": ["json", "firestore"],
            "default": "json",
            "description": "\"firestore\" reads a Firestore REST API document URL."
          }
        }
      }
    }
  }
}
